{
  "schema_version": 1,
  "identity": {
    "name": "c3-vanilla-pavilion",
    "seed": 20260910,
    "description": "Deterministic vanilla pavilion golden for Construction C3."
  },
  "target": {
    "minecraft_version": "1.21.1",
    "loader": "none"
  },
  "bounds": {
    "size": {
      "x": 7,
      "y": 5,
      "z": 7
    }
  },
  "coordinate_system": {
    "axes": [
      "x",
      "y",
      "z"
    ],
    "up": "y",
    "origin": "min_corner",
    "unit": "block"
  },
  "palette": [
    {
      "name": "minecraft:oak_log",
      "properties": {
        "axis": "y"
      }
    },
    {
      "name": "minecraft:oak_planks",
      "properties": {}
    },
    {
      "name": "minecraft:stone_bricks",
      "properties": {}
    }
  ],
  "blocks": [
    {"x":0,"y":0,"z":0,"palette_index":2},
    {"x":0,"y":0,"z":1,"palette_index":2},
    {"x":0,"y":0,"z":2,"palette_index":2},
    {"x":0,"y":0,"z":3,"palette_index":2},
    {"x":0,"y":0,"z":4,"palette_index":2},
    {"x":0,"y":0,"z":5,"palette_index":2},
    {"x":0,"y":0,"z":6,"palette_index":2},
    {"x":0,"y":1,"z":0,"palette_index":0},
    {"x":0,"y":1,"z":6,"palette_index":0},
    {"x":0,"y":2,"z":0,"palette_index":0},
    {"x":0,"y":2,"z":6,"palette_index":0},
    {"x":0,"y":3,"z":0,"palette_index":0},
    {"x":0,"y":3,"z":6,"palette_index":0},
    {"x":0,"y":4,"z":0,"palette_index":1},
    {"x":0,"y":4,"z":1,"palette_index":1},
    {"x":0,"y":4,"z":2,"palette_index":1},
    {"x":0,"y":4,"z":3,"palette_index":1},
    {"x":0,"y":4,"z":4,"palette_index":1},
    {"x":0,"y":4,"z":5,"palette_index":1},
    {"x":0,"y":4,"z":6,"palette_index":1},
    {"x":1,"y":0,"z":0,"palette_index":2},
    {"x":1,"y":0,"z":1,"palette_index":2},
    {"x":1,"y":0,"z":2,"palette_index":2},
    {"x":1,"y":0,"z":3,"palette_index":2},
    {"x":1,"y":0,"z":4,"palette_index":2},
    {"x":1,"y":0,"z":5,"palette_index":2},
    {"x":1,"y":0,"z":6,"palette_index":2},
    {"x":1,"y":4,"z":0,"palette_index":1},
    {"x":1,"y":4,"z":1,"palette_index":1},
    {"x":1,"y":4,"z":2,"palette_index":1},
    {"x":1,"y":4,"z":3,"palette_index":1},
    {"x":1,"y":4,"z":4,"palette_index":1},
    {"x":1,"y":4,"z":5,"palette_index":1},
    {"x":1,"y":4,"z":6,"palette_index":1},
    {"x":2,"y":0,"z":0,"palette_index":2},
    {"x":2,"y":0,"z":1,"palette_index":2},
    {"x":2,"y":0,"z":2,"palette_index":2},
    {"x":2,"y":0,"z":3,"palette_index":2},
    {"x":2,"y":0,"z":4,"palette_index":2},
    {"x":2,"y":0,"z":5,"palette_index":2},
    {"x":2,"y":0,"z":6,"palette_index":2},
    {"x":2,"y":4,"z":0,"palette_index":1},
    {"x":2,"y":4,"z":1,"palette_index":1},
    {"x":2,"y":4,"z":2,"palette_index":1},
    {"x":2,"y":4,"z":3,"palette_index":1},
    {"x":2,"y":4,"z":4,"palette_index":1},
    {"x":2,"y":4,"z":5,"palette_index":1},
    {"x":2,"y":4,"z":6,"palette_index":1},
    {"x":3,"y":0,"z":0,"palette_index":2},
    {"x":3,"y":0,"z":1,"palette_index":2},
    {"x":3,"y":0,"z":2,"palette_index":2},
    {"x":3,"y":0,"z":3,"palette_index":2},
    {"x":3,"y":0,"z":4,"palette_index":2},
    {"x":3,"y":0,"z":5,"palette_index":2},
    {"x":3,"y":0,"z":6,"palette_index":2},
    {"x":3,"y":4,"z":0,"palette_index":1},
    {"x":3,"y":4,"z":1,"palette_index":1},
    {"x":3,"y":4,"z":2,"palette_index":1},
    {"x":3,"y":4,"z":3,"palette_index":1},
    {"x":3,"y":4,"z":4,"palette_index":1},
    {"x":3,"y":4,"z":5,"palette_index":1},
    {"x":3,"y":4,"z":6,"palette_index":1},
    {"x":4,"y":0,"z":0,"palette_index":2},
    {"x":4,"y":0,"z":1,"palette_index":2},
    {"x":4,"y":0,"z":2,"palette_index":2},
    {"x":4,"y":0,"z":3,"palette_index":2},
    {"x":4,"y":0,"z":4,"palette_index":2},
    {"x":4,"y":0,"z":5,"palette_index":2},
    {"x":4,"y":0,"z":6,"palette_index":2},
    {"x":4,"y":4,"z":0,"palette_index":1},
    {"x":4,"y":4,"z":1,"palette_index":1},
    {"x":4,"y":4,"z":2,"palette_index":1},
    {"x":4,"y":4,"z":3,"palette_index":1},
    {"x":4,"y":4,"z":4,"palette_index":1},
    {"x":4,"y":4,"z":5,"palette_index":1},
    {"x":4,"y":4,"z":6,"palette_index":1},
    {"x":5,"y":0,"z":0,"palette_index":2},
    {"x":5,"y":0,"z":1,"palette_index":2},
    {"x":5,"y":0,"z":2,"palette_index":2},
    {"x":5,"y":0,"z":3,"palette_index":2},
    {"x":5,"y":0,"z":4,"palette_index":2},
    {"x":5,"y":0,"z":5,"palette_index":2},
    {"x":5,"y":0,"z":6,"palette_index":2},
    {"x":5,"y":4,"z":0,"palette_index":1},
    {"x":5,"y":4,"z":1,"palette_index":1},
    {"x":5,"y":4,"z":2,"palette_index":1},
    {"x":5,"y":4,"z":3,"palette_index":1},
    {"x":5,"y":4,"z":4,"palette_index":1},
    {"x":5,"y":4,"z":5,"palette_index":1},
    {"x":5,"y":4,"z":6,"palette_index":1},
    {"x":6,"y":0,"z":0,"palette_index":2},
    {"x":6,"y":0,"z":1,"palette_index":2},
    {"x":6,"y":0,"z":2,"palette_index":2},
    {"x":6,"y":0,"z":3,"palette_index":2},
    {"x":6,"y":0,"z":4,"palette_index":2},
    {"x":6,"y":0,"z":5,"palette_index":2},
    {"x":6,"y":0,"z":6,"palette_index":2},
    {"x":6,"y":1,"z":0,"palette_index":0},
    {"x":6,"y":1,"z":6,"palette_index":0},
    {"x":6,"y":2,"z":0,"palette_index":0},
    {"x":6,"y":2,"z":6,"palette_index":0},
    {"x":6,"y":3,"z":0,"palette_index":0},
    {"x":6,"y":3,"z":6,"palette_index":0},
    {"x":6,"y":4,"z":0,"palette_index":1},
    {"x":6,"y":4,"z":1,"palette_index":1},
    {"x":6,"y":4,"z":2,"palette_index":1},
    {"x":6,"y":4,"z":3,"palette_index":1},
    {"x":6,"y":4,"z":4,"palette_index":1},
    {"x":6,"y":4,"z":5,"palette_index":1},
    {"x":6,"y":4,"z":6,"palette_index":1}
  ],
  "metadata": {
    "build_spec_sha256": "20e1119cc06d0bfb1a40996f2e635d1d86d44ea17a1644c05d7a89cec255a7d7",
    "producer": "schematica",
    "producer_version": "0c88770005e7bbd7246997c81e810ba935c8e4cf",
    "content_sha256": "76dfe4de03ed335dbb21b04cabacdb0bac28a078637069e343193bf144cacdd0"
  }
}
